{
  "$id": "https://schemas.defra.ai/gents/adapter-projection/langgraph_state_history/v1.schema.json",
  "$schema": "https://json-schema.org/draft/2020-12/schema",
  "additionalProperties": false,
  "properties": {
    "output": {
      "additionalProperties": false,
      "properties": {
        "adapter": {
          "const": "langgraph_state_history"
        },
        "projection": {
          "additionalProperties": false,
          "properties": {
            "checkpoint_id": {
              "type": "string"
            },
            "edges": {
              "items": {
                "additionalProperties": false,
                "properties": {
                  "from": {
                    "type": "string"
                  },
                  "kind": {
                    "type": "string"
                  },
                  "to": {
                    "type": "string"
                  }
                },
                "required": [
                  "from",
                  "to",
                  "kind"
                ],
                "type": "object"
              },
              "type": "array"
            },
            "nodes": {
              "items": {
                "additionalProperties": false,
                "properties": {
                  "node_did": {
                    "anyOf": [
                      {
                        "type": "string"
                      },
                      {
                        "type": "null"
                      }
                    ]
                  },
                  "agent_id": {
                    "anyOf": [
                      {
                        "type": "string"
                      },
                      {
                        "type": "null"
                      }
                    ]
                  },
                  "content": {
                    "anyOf": [
                      {
                        "type": "string"
                      },
                      {
                        "type": "null"
                      }
                    ]
                  },
                  "id": {
                    "type": "string"
                  },
                  "kind": {
                    "type": "string"
                  },
                  "parent_request_id": {
                    "anyOf": [
                      {
                        "type": "string"
                      },
                      {
                        "type": "null"
                      }
                    ]
                  },
                  "parent_tool_call_id": {
                    "anyOf": [
                      {
                        "type": "string"
                      },
                      {
                        "type": "null"
                      }
                    ]
                  },
                  "reasoning": {
                    "anyOf": [
                      {
                        "type": "string"
                      },
                      {
                        "type": "null"
                      }
                    ]
                  },
                  "request_id": {
                    "anyOf": [
                      {
                        "type": "string"
                      },
                      {
                        "type": "null"
                      }
                    ]
                  },
                  "status": {
                    "anyOf": [
                      {
                        "type": "string"
                      },
                      {
                        "type": "null"
                      }
                    ]
                  }
                },
                "required": [
                  "id",
                  "kind"
                ],
                "type": "object"
              },
              "type": "array"
            },
            "root_request_id": {
              "type": "string"
            },
            "tasks": {
              "items": {
                "additionalProperties": false,
                "properties": {
                  "child_request_id": {
                    "anyOf": [
                      {
                        "type": "string"
                      },
                      {
                        "type": "null"
                      }
                    ]
                  },
                  "id": {
                    "type": "string"
                  },
                  "name": {
                    "type": "string"
                  },
                  "request_id": {
                    "anyOf": [
                      {
                        "type": "string"
                      },
                      {
                        "type": "null"
                      }
                    ]
                  },
                  "status": {
                    "type": "string"
                  }
                },
                "required": [
                  "id",
                  "name",
                  "status"
                ],
                "type": "object"
              },
              "type": "array"
            },
            "thread_id": {
              "anyOf": [
                {
                  "type": "string"
                },
                {
                  "type": "null"
                }
              ]
            },
            "values": {
              "type": "object"
            }
          },
          "required": [
            "checkpoint_id",
            "root_request_id",
            "values",
            "nodes",
            "edges",
            "tasks"
          ],
          "type": "object"
        }
      },
      "required": [
        "adapter",
        "projection"
      ],
      "type": "object"
    },
    "projection_id": {
      "const": "langgraph_state_history"
    },
    "projection_version": {
      "const": "v1"
    },
    "provenance": {
      "additionalProperties": false,
      "properties": {
        "actor_did": {
          "anyOf": [
            {
              "type": "string"
            },
            {
              "type": "null"
            }
          ]
        },
        "rendered_request_refs": {
          "items": {
            "additionalProperties": false,
            "properties": {
              "capture_doc_id": {
                "type": "string"
              },
              "request_commit_cid": {
                "type": "string"
              },
              "request_doc_id": {
                "type": "string"
              }
            },
            "required": [
              "capture_doc_id",
              "request_doc_id",
              "request_commit_cid"
            ],
            "type": "object"
          },
          "type": "array"
        },
        "runtime": {
          "const": "gents"
        },
        "source_projection_id": {
          "enum": [
            "run_timeline",
            "external_adapter_capture"
          ]
        },
        "source_projection_version": {
          "const": "v1"
        },
        "source_version_status": {
          "enum": [
            "current_state_captured_only",
            "external_adapter_capture"
          ]
        }
      },
      "required": [
        "runtime",
        "source_projection_id",
        "source_projection_version",
        "source_version_status"
      ],
      "type": "object"
    },
    "redaction_mode": {
      "enum": [
        "full",
        "training_safe",
        "public"
      ]
    },
    "rendered_captures": {
      "items": {
        "additionalProperties": false,
        "properties": {
          "attempt": {
            "type": "integer"
          },
          "call_id": {
            "anyOf": [
              {
                "type": "string"
              },
              {
                "type": "null"
              }
            ]
          },
          "call_seq": {
            "type": "integer"
          },
          "capture_key": {
            "type": "string"
          },
          "capture_scope": {
            "anyOf": [
              {
                "type": "string"
              },
              {
                "type": "null"
              }
            ]
          },
          "capture_version": {
            "type": "integer"
          },
          "created_at": {
            "anyOf": [
              {
                "type": "string"
              },
              {
                "type": "null"
              }
            ]
          },
          "manifest_version": {
            "type": "integer"
          },
          "model_name": {
            "anyOf": [
              {
                "type": "string"
              },
              {
                "type": "null"
              }
            ]
          },
          "prompt_hash": {
            "anyOf": [
              {
                "type": "string"
              },
              {
                "type": "null"
              }
            ]
          },
          "provenance_status": {
            "type": "string"
          },
          "request_doc_id": {
            "anyOf": [
              {
                "type": "string"
              },
              {
                "type": "null"
              }
            ]
          },
          "request_id": {
            "anyOf": [
              {
                "type": "string"
              },
              {
                "type": "null"
              }
            ]
          },
          "scope_kind": {
            "anyOf": [
              {
                "type": "string"
              },
              {
                "type": "null"
              }
            ]
          },
          "scope_seq": {
            "type": "integer"
          },
          "session_id": {
            "anyOf": [
              {
                "type": "string"
              },
              {
                "type": "null"
              }
            ]
          },
          "source": {
            "anyOf": [
              {
                "type": "string"
              },
              {
                "type": "null"
              }
            ]
          },
          "tools_hash": {
            "anyOf": [
              {
                "type": "string"
              },
              {
                "type": "null"
              }
            ]
          },
          "turn_index": {
            "type": "integer"
          }
        },
        "required": [
          "capture_key",
          "provenance_status"
        ],
        "type": "object"
      },
      "type": "array"
    },
    "source_node_did": {
      "anyOf": [
        {
          "type": "string"
        },
        {
          "type": "null"
        }
      ]
    },
    "source_agent_id": {
      "anyOf": [
        {
          "type": "string"
        },
        {
          "type": "null"
        }
      ]
    },
    "source_request_doc_id": {
      "anyOf": [
        {
          "type": "string"
        },
        {
          "type": "null"
        }
      ]
    },
    "source_request_id": {
      "type": "string"
    },
    "source_session_id": {
      "anyOf": [
        {
          "type": "string"
        },
        {
          "type": "null"
        }
      ]
    }
  },
  "required": [
    "projection_id",
    "projection_version",
    "source_request_id",
    "redaction_mode",
    "provenance",
    "output"
  ],
  "title": "LangGraph State History Projection",
  "type": "object"
}